197,,WebGL,Fixed OffscreenCanvas.transferToImageBuffer() to clear the WebGL drawing buffer. (279434@main)  (126738038),https://commits.webkit.org/279434@main,https://bugs.webkit.org/buglist.cgi?content=279434@main
198,,CSS,Added support for the :active-view-transition pseudo-class. (280027@main)  (129851076),https://commits.webkit.org/280027@main,https://bugs.webkit.org/buglist.cgi?content=280027@main
198,,Forms,Fixed input elements to use the [value] as the first fallback step base. (280127@main)  (107721910),https://commits.webkit.org/280127@main,https://bugs.webkit.org/buglist.cgi?content=280127@main
198,,JavaScript,Fixed V128 values to be throwable to match the specification. (279989@main)  (106030051),https://commits.webkit.org/279989@main,https://bugs.webkit.org/buglist.cgi?content=279989@main
198,,Media,Fixed missing picture-in-picture when leaving Safari with picture-in-picture enabled from video viewer. (279877@main)  (124376686),https://commits.webkit.org/279877@main,https://bugs.webkit.org/buglist.cgi?content=279877@main
198,,Media,Fixed the context menu to show “Exit Viewer” when using video viewer. (280128@main)  (126300924),https://commits.webkit.org/280128@main,https://bugs.webkit.org/buglist.cgi?content=280128@main
198,,Rendering,Fixed scrolling in a flexbox container. (279992@main)  (129343181),https://commits.webkit.org/279992@main,https://bugs.webkit.org/buglist.cgi?content=279992@main
198,,Safari Extensions,Fixed throwing an exception when calling browser.storage.set with undefined as a map value. (280265@main)  (130282050),https://commits.webkit.org/280265@main,https://bugs.webkit.org/buglist.cgi?content=280265@main
198,,SVG,Removed non-standard getTransformToElement from SVGGraphicsElement (280208@main)  (122435702),https://commits.webkit.org/280208@main,https://bugs.webkit.org/buglist.cgi?content=280208@main
198,,Web API,Fixed an issue when inserting writing suggestions into an editable display: grid container. (279986@main)  (129366300),https://commits.webkit.org/279986@main,https://bugs.webkit.org/buglist.cgi?content=279986@main
198,,Web Inspector,Fixed disappearing objects and disclosure triangles when Web Inspector is at narrow widths. (279894@main)  (121861970),https://commits.webkit.org/279894@main,https://bugs.webkit.org/buglist.cgi?content=279894@main
198,,Web Inspector,Fixed the list of breakpoints in the Sources tab disappearing when Web Inspector is reloaded. (279884@main)  (123641994),https://commits.webkit.org/279884@main,https://bugs.webkit.org/buglist.cgi?content=279884@main
198,,WebRTC,Fixed RTCEncodedVideoFrame and RTCEncodedAudioFrame to match the WebIDL specification. (280198@main)  (118607685),https://commits.webkit.org/280198@main,https://bugs.webkit.org/buglist.cgi?content=280198@main
199,,Apple Pay,Fixed arbitrary 8 digit limit on a line item’s total amount. (280584@main)  (112078798),https://commits.webkit.org/280584@main,https://bugs.webkit.org/buglist.cgi?content=280584@main
199,,CSS,Added support for (prefers-contrast: custom). (280383@main)  (103658875),https://commits.webkit.org/280383@main,https://bugs.webkit.org/buglist.cgi?content=280383@main
199,,CSS,Fixed computed values for text-box-edge. (280413@main)  (117643064),https://commits.webkit.org/280413@main,https://bugs.webkit.org/buglist.cgi?content=280413@main
199,,CSS,Fixed: Improved large Grid performance. (280473@main)  (130728344),https://commits.webkit.org/280473@main,https://bugs.webkit.org/buglist.cgi?content=280473@main
199,,Editing,Fixed an issue where input method editing would sporadically drop the composition range. (280291@main)  (130020224),https://commits.webkit.org/280291@main,https://bugs.webkit.org/buglist.cgi?content=280291@main
199,,JavaScript,Added support for Uint8Array.prototype.toBase64 and Uint8Array.prototype.toHex. (280654@main)  (129045737),https://commits.webkit.org/280654@main,https://bugs.webkit.org/buglist.cgi?content=280654@main
199,,JavaScript,Fixed Intl.DurationFormat for numeric and 2-digit. (280460@main)  (130279541),https://commits.webkit.org/280460@main,https://bugs.webkit.org/buglist.cgi?content=280460@main
199,,Media,Fixed missing picture-in-picture when leaving Safari with picture-in-picture enabled from video viewer. (279877@main)  (124376686),https://commits.webkit.org/279877@main,https://bugs.webkit.org/buglist.cgi?content=279877@main
199,,Media,Fixed a hang in WebAudio. (280604@main)  (130531570),https://commits.webkit.org/280604@main,https://bugs.webkit.org/buglist.cgi?content=280604@main
199,,Rendering,"Fixed support for border, padding, and margin on mfrac and mspace elements in MathML. (280665@main)  (131119823)",https://commits.webkit.org/280665@main,https://bugs.webkit.org/buglist.cgi?content=280665@main
199,,Text,Fixed disclosure counter styles to consider writing-mode. (280433@main)  (130468537),https://commits.webkit.org/280433@main,https://bugs.webkit.org/buglist.cgi?content=280433@main
199,,WebRTC,Fixed RTCAudioPlayoutStats to match web specifications. (280461@main)  (130767124),https://commits.webkit.org/280461@main,https://bugs.webkit.org/buglist.cgi?content=280461@main
200,,CSS,Fixed: Optimized Masonry Grids for items with a span of 1. (280919@main)  (131407028),https://commits.webkit.org/280919@main,https://bugs.webkit.org/buglist.cgi?content=280919@main
200,,JavaScript,Implemented Uint8Array.prototype.toHex in SIMD. (280719@main)  (131249821),https://commits.webkit.org/280719@main,https://bugs.webkit.org/buglist.cgi?content=280719@main
200,,JavaScript,Fixed class field initializers to disallow yield and await expressions. (280837@main)  (119044881),https://commits.webkit.org/280837@main,https://bugs.webkit.org/buglist.cgi?content=280837@main
200,,JavaScript,Fixed DestructuringAssignmentTarget to be evaluated prior to calling [[Get]] or a stepping iterator. (281013@main)  (121960976),https://commits.webkit.org/281013@main,https://bugs.webkit.org/buglist.cgi?content=281013@main
200,,JavaScript,Fixed throwing an exception for negative exponent in BigInt in the JIT compiler. (280841@main)  (131051084),https://commits.webkit.org/280841@main,https://bugs.webkit.org/buglist.cgi?content=280841@main
200,,JavaScript,Fixed RegExp range quantifier to allow 2^53 – 1. (280953@main)  (131710011),https://commits.webkit.org/280953@main,https://bugs.webkit.org/buglist.cgi?content=280953@main
200,,Rendering,Fixed garbled bold text caused by glyph lookup using the wrong font’s glyph IDs when multiple installed fonts have the same name. (281022@main)  (129891005) (FB13909556),https://commits.webkit.org/281022@main,https://bugs.webkit.org/buglist.cgi?content=281022@main
200,,Rendering,Fixed scrolling of content overflowing a flex item in an end-aligned flex container. (279992@main)  (131201271),https://commits.webkit.org/279992@main,https://bugs.webkit.org/buglist.cgi?content=279992@main
200,,Web Extensions,Fixed Service Workers not appearing in the Develop menu or remote Web Inspector menu. (280912@main)  (130712941),https://commits.webkit.org/280912@main,https://bugs.webkit.org/buglist.cgi?content=280912@main
