222,,Accessibility,"Fixed <figcaption> within a <figure> element to only contribute to the accessible name of an <img> element if the image lacks other labeling methods like alt, ARIA attributes, or the title attribute. (295746@main)  (150597445)",https://commits.webkit.org/295746@main,https://bugs.webkit.org/buglist.cgi?content=295746@main
222,,Accessibility,Fixed handling of invalid values for aria-setsize and aria-posinset according to the most-recent revision of the ARIA specification. (295814@main)  (151113693),https://commits.webkit.org/295814@main,https://bugs.webkit.org/buglist.cgi?content=295814@main
222,,Accessibility,Fixed VoiceOver reading “Processing page %infinity” when loading large pages. (295858@main)  (152617082),https://commits.webkit.org/295858@main,https://bugs.webkit.org/buglist.cgi?content=295858@main
222,,CSS,Added support for implicit anchor elements for pseudo-elements with anchor functions. (295871@main)  (152635393),https://commits.webkit.org/295871@main,https://bugs.webkit.org/buglist.cgi?content=295871@main
222,,Media,Fixed video elements with WebM object URLs causing MediaError code 2. (295802@main)  (151234095),https://commits.webkit.org/295802@main,https://bugs.webkit.org/buglist.cgi?content=295802@main
222,,Rendering,Fixed CSS filters to establish a containing block like transform does. (295958@main)  (119130847),https://commits.webkit.org/295958@main,https://bugs.webkit.org/buglist.cgi?content=295958@main
222,,Rendering,Fixed CSS gradient interpolation for “longer hue” gradients when an end color stop is omitted. (295860@main)  (142738948),https://commits.webkit.org/295860@main,https://bugs.webkit.org/buglist.cgi?content=295860@main
222,,Scrolling,Fixed inconsistent decimal values from getBoundingClientRect for sticky elements. (295783@main)  (147163986),https://commits.webkit.org/295783@main,https://bugs.webkit.org/buglist.cgi?content=295783@main
222,,Web API,Fixed the <option> element to not trim the label value and correctly handle an empty label. (295708@main)  (151309514),https://commits.webkit.org/295708@main,https://bugs.webkit.org/buglist.cgi?content=295708@main