,18.0,Accessibility,"Added support for <input type=""datetime"">, <input type=""datetime-local"">, and <time> elements.  (118180250)",,https://bugs.webkit.org/buglist.cgi?content=118180250
,18.0,Accessibility,Added support for ariaBrailleLabel and ariaBrailleRoleDescription element reflection properties.  (123926949),,https://bugs.webkit.org/buglist.cgi?content=123926949
,18.0,Accessibility,Fixed role assignment for <header> inside <main> and sectioning elements.  (48370244),,https://bugs.webkit.org/buglist.cgi?content=48370244
,18.0,Accessibility,Fixed range input not firing an input event when incremented or decremented via accessibility APIs.  (85707481),,https://bugs.webkit.org/buglist.cgi?content=85707481
,18.0,Accessibility,Fixed setting aria-hidden on a slot not hiding the slot’s assigned nodes.  (108762653),,https://bugs.webkit.org/buglist.cgi?content=108762653
,18.0,Accessibility,Fixed VoiceOver to read hidden associated labels.  (113631557),,https://bugs.webkit.org/buglist.cgi?content=113631557
,18.0,Accessibility,Fixed comboboxes to expose their linked objects correctly.  (121242926),,https://bugs.webkit.org/buglist.cgi?content=121242926
,18.0,Accessibility,Fixed VoiceOver support for aria-activedescendant on macOS.  (122590052),,https://bugs.webkit.org/buglist.cgi?content=122590052
,18.0,Accessibility,Fixed time input accessibility by adding labels to subfields.  (122590568),,https://bugs.webkit.org/buglist.cgi?content=122590568
,18.0,Accessibility,Fixed aria-hidden=true to be ignored on the <body> and <html> elements.  (123049663),,https://bugs.webkit.org/buglist.cgi?content=123049663
,18.0,Accessibility,Fixed datetime values being exposed to assistive technologies in the wrong timezone.  (123522296),,https://bugs.webkit.org/buglist.cgi?content=123522296
,18.0,Accessibility,Fixed wrong datetime value being exposed to assistive technologies for datetime-local inputs.  (123803281),,https://bugs.webkit.org/buglist.cgi?content=123803281
,18.0,Accessibility,Fixed ignored CSS content property replacement text when it is an empty string.  (123919677),,https://bugs.webkit.org/buglist.cgi?content=123919677
,18.0,Accessibility,"Fixed the computed role for these elements: dd, details, dt, em, hgroup, option, s, and strong.  (124641956)",,https://bugs.webkit.org/buglist.cgi?content=124641956
,18.0,Accessibility,"Fixed hidden elements targeted by aria-labelledby to expose their entire subtree text, not just their direct child text.  (125634439)",,https://bugs.webkit.org/buglist.cgi?content=125634439
,18.0,Accessibility,Fixed accessible name computation for elements with visibility: visible inside a container with visibility: hidden.  (125738704),,https://bugs.webkit.org/buglist.cgi?content=125738704
,18.0,Accessibility,Fixed updating table accessibility text when its caption dynamically changes.  (127263464),,https://bugs.webkit.org/buglist.cgi?content=127263464
,18.0,Accessibility,Fixed updating aria-describedby text after the targeted element changes its subtree.  (127390465),,https://bugs.webkit.org/buglist.cgi?content=127390465
,18.0,Animations,Fixed the transition property to produce the shortest serialization.  (119822401),,https://bugs.webkit.org/buglist.cgi?content=119822401
,18.0,Animations,Fixed the animation property to produce the shortest serialization.  (120439368),,https://bugs.webkit.org/buglist.cgi?content=120439368
,18.0,Apple Pay,Added support for funds transfer.  (104115471),,https://bugs.webkit.org/buglist.cgi?content=104115471
,18.0,Apple Pay,Fixed arbitrary 8 digit limit on a line item’s total amount.  (112078798),,https://bugs.webkit.org/buglist.cgi?content=112078798
,18.0,Authentication,Implemented conditional credential creation.  (113573376),,https://bugs.webkit.org/buglist.cgi?content=113573376
,18.0,Authentication,Added support for the WebAuthn PRF extension.  (119057355),,https://bugs.webkit.org/buglist.cgi?content=119057355
,18.0,Authentication,Added support for using passkeys across related origins.  (121477346),,https://bugs.webkit.org/buglist.cgi?content=121477346
,18.0,Authentication,Fixed navigator.credentials.create() rejects with “NotAllowedError: Operation Failed” after a conditional UI request is aborted.  (109936742),,https://bugs.webkit.org/buglist.cgi?content=109936742
,18.0,Authentication,Fixed setting the cancel flag once the cancel completes regardless of a subsequent request occurring.  (124727713),,https://bugs.webkit.org/buglist.cgi?content=124727713
,18.0,Canvas,Added support for willReadFrequently.  (126739379),,https://bugs.webkit.org/buglist.cgi?content=126739379
,18.0,Canvas,Added support for resolving a nested currentcolor used in color-mix or a relative color.  (128027026),,https://bugs.webkit.org/buglist.cgi?content=128027026
,18.0,Canvas,Fixed drawImage(detachedOffscreenCanvas) to throw an exception.  (120451062),,https://bugs.webkit.org/buglist.cgi?content=120451062
,18.0,Canvas,Fixed OffscreenCanvas failing to render to the placeholder with nested workers.  (126069375),,https://bugs.webkit.org/buglist.cgi?content=126069375
,18.0,Canvas,Fixed losing the contents layer of the placeholder canvas of OffscreenCanvas when switching off the tab.  (126070648),,https://bugs.webkit.org/buglist.cgi?content=126070648
,18.0,Canvas,Fixed drawImage to not alter the input source or the destination rectangles.  (127982607),,https://bugs.webkit.org/buglist.cgi?content=127982607
,18.0,Canvas,Fixed toggling the visibility on a canvas parent undoing the effect of clearRect().  (128226178),,https://bugs.webkit.org/buglist.cgi?content=128226178
,18.0,Canvas,Fixed the Canvas drawImage() API to throw an exception when the image is in broken state.  (128588063),,https://bugs.webkit.org/buglist.cgi?content=128588063
,18.0,Canvas,Fixed a detached OffscreenCanvas to not transfer an ImageBuffer.  (129270155),,https://bugs.webkit.org/buglist.cgi?content=129270155
,18.0,Canvas,Removed support for OffscreenCanvasRenderingContext2D’s commit() method.  (126758254),,https://bugs.webkit.org/buglist.cgi?content=126758254
,18.0,Cookies,Fixed treating the lack of an explicit “SameSite” attribute as “SameSite=Lax”.  (96026173),,https://bugs.webkit.org/buglist.cgi?content=96026173
,18.0,CSS,Added support for currentColor and system color keywords to Relative Color Syntax.  (100981965),,https://bugs.webkit.org/buglist.cgi?content=100981965
,18.0,CSS,Added support for (prefers-contrast: custom).  (103658875),,https://bugs.webkit.org/buglist.cgi?content=103658875
,18.0,CSS,Added support for content-visibility.  (117156105),,https://bugs.webkit.org/buglist.cgi?content=117156105
,18.0,CSS,Added support for animating the display property.  (121662911),,https://bugs.webkit.org/buglist.cgi?content=121662911
,18.0,CSS,Added support for CSS Style Container Queries.  (122800215),,https://bugs.webkit.org/buglist.cgi?content=122800215
,18.0,CSS,Added support for View Transitions.  (123128491),,https://bugs.webkit.org/buglist.cgi?content=123128491
,18.0,CSS,Added support for the unprefixed backdrop-filter.  (123523441),,https://bugs.webkit.org/buglist.cgi?content=123523441
,18.0,CSS,Added support for the :active-view-transition pseudo-class.  (129851076),,https://bugs.webkit.org/buglist.cgi?content=129851076
,18.0,CSS,Fixed setting white-space to a non-default value dynamically on a whitespace or a new line.  (92559818),,https://bugs.webkit.org/buglist.cgi?content=92559818
,18.0,CSS,Fixed custom counter styles disclosure-open and disclosure-closed to point to the correct direction in right-to-left.  (109014745),,https://bugs.webkit.org/buglist.cgi?content=109014745
,18.0,CSS,Fixed backface-visibility to create a stacking context and containing block.  (114732608),,https://bugs.webkit.org/buglist.cgi?content=114732608
,18.0,CSS,Fixed getComputedStyle() to work with functional pseudo-elements like ::highlight().  (117864743),,https://bugs.webkit.org/buglist.cgi?content=117864743
,18.0,CSS,Fixed: Aliased :-webkit-full-screen pseudo-class to :fullscreen.  (120335917),,https://bugs.webkit.org/buglist.cgi?content=120335917
,18.0,CSS,Fixed: Aliased :-webkit-any-link to :any-link and :matches() to :is().  (120337922),,https://bugs.webkit.org/buglist.cgi?content=120337922
,18.0,CSS,Fixed getComputedStyle() pseudo-element parsing to support the full range of CSS syntax.  (120471227),,https://bugs.webkit.org/buglist.cgi?content=120471227
,18.0,CSS,Fixed @supports to correctly handle support for some -webkit prefixed pseudo-elements that were incorrectly treated as unsupported.  (120577690),,https://bugs.webkit.org/buglist.cgi?content=120577690
,18.0,CSS,Fixed updating media-query sensitive meta tags after style changes.  (120854167),,https://bugs.webkit.org/buglist.cgi?content=120854167
,18.0,CSS,Fixed changing color scheme to update gradients with system colors or light-dark().  (121285450),,https://bugs.webkit.org/buglist.cgi?content=121285450
,18.0,CSS,Fixed incorrect inline element size when using font-variant-caps: all-small-caps with font-synthesis.  (121314557),,https://bugs.webkit.org/buglist.cgi?content=121314557
,18.0,CSS,Fixed :empty selector to work with animations.  (122838142),,https://bugs.webkit.org/buglist.cgi?content=122838142
,18.0,CSS,Fixed preserving whitespace when serializing custom properties.  (123491915),,https://bugs.webkit.org/buglist.cgi?content=123491915
,18.0,CSS,Fixed updating style correctly for non-inherited custom property mutations.  (123645196),,https://bugs.webkit.org/buglist.cgi?content=123645196
,18.0,CSS,Fixed element removed by parent to end up losing the last remembered size.  (123975513),,https://bugs.webkit.org/buglist.cgi?content=123975513
,18.0,CSS,Fixed an incorrect difference between implicit and explicit initial values for custom properties.  (124573975),,https://bugs.webkit.org/buglist.cgi?content=124573975
,18.0,CSS,Fixed the contrast of Menu and MenuText system colors.  (125270664),,https://bugs.webkit.org/buglist.cgi?content=125270664
,18.0,CSS,Fixed keeping the shorthand value for CSS gap as-is in serialized and computed values.  (125335787),,https://bugs.webkit.org/buglist.cgi?content=125335787
,18.0,CSS,Fixed the style adjuster for @starting-style incorrectly invoking with a null element.  (125837628),,https://bugs.webkit.org/buglist.cgi?content=125837628
,18.0,CSS,Fixed excluding -apple-pay-button from applying to any element that supports appearance: auto and is not a button.  (126107516),,https://bugs.webkit.org/buglist.cgi?content=126107516
,18.0,CSS,Fixed missing color interpretation methods added to CSS color specifications.  (126444371),,https://bugs.webkit.org/buglist.cgi?content=126444371
,18.0,CSS,Fixed hsl() and hsla() implementation to match the latest spec changes.  (126722229),,https://bugs.webkit.org/buglist.cgi?content=126722229
,18.0,CSS,Fixed the implementation of rgb() and rgba() to match the latest spec.  (126830606),,https://bugs.webkit.org/buglist.cgi?content=126830606
,18.0,CSS,Fixed the hwb() implementation to match the latest spec.  (126924645),,https://bugs.webkit.org/buglist.cgi?content=126924645
,18.0,CSS,Fixed the remaining color types to be synced with the latest spec changes.  (127077683),,https://bugs.webkit.org/buglist.cgi?content=127077683
,18.0,CSS,Fixed carrying analogous components forward when interpolating colors.  (127170141),,https://bugs.webkit.org/buglist.cgi?content=127170141
,18.0,CSS,Fixed applying the fill layer pattern for mask-mode.  (127999241),,https://bugs.webkit.org/buglist.cgi?content=127999241
,18.0,CSS,Fixed backdrop-filter: blur to render for elements not present when the page is loaded.  (129517679),,https://bugs.webkit.org/buglist.cgi?content=129517679
,18.0,CSS,Fixed: Improved large Grid performance.  (130728344),,https://bugs.webkit.org/buglist.cgi?content=130728344
,18.0,CSS,Fixed some CSS properties causing quotes to be reset.  (132585704),,https://bugs.webkit.org/buglist.cgi?content=132585704
,18.0,CSS,Removed WEBKIT_KEYFRAMES_RULE and WEBKIT_KEYFRAME_RULE in CSSRule.  (97084520),,https://bugs.webkit.org/buglist.cgi?content=97084520
,18.0,CSS,Removed :-webkit-full-screen-ancestor pseudo-class.  (100782937),,https://bugs.webkit.org/buglist.cgi?content=100782937
,18.0,CSS,Removed -webkit-alt and alt properties.  (120051066),,https://bugs.webkit.org/buglist.cgi?content=120051066
,18.0,CSS,Removed the non-standard resize: auto rule.  (120138995),,https://bugs.webkit.org/buglist.cgi?content=120138995
,18.0,CSS,Removed :-webkit-animating-full-screen-transition pseudo-class.  (121302758),,https://bugs.webkit.org/buglist.cgi?content=121302758
,18.0,CSS,Removed :-khtml-drag pseudo-class.  (121303391),,https://bugs.webkit.org/buglist.cgi?content=121303391
,18.0,CSS,Removed :-webkit-full-screen-controls-hidden pseudo-class.  (121323330),,https://bugs.webkit.org/buglist.cgi?content=121323330
,18.0,CSS,Removed :-webkit-full-page-media pseudo-class.  (121752962),,https://bugs.webkit.org/buglist.cgi?content=121752962
,18.0,CSS,Removed :-webkit-full-screen-document pseudo-class.  (121816310),,https://bugs.webkit.org/buglist.cgi?content=121816310
,18.0,Editing,Added writingsuggestions attribute to HTML elements to opt into multiword text completions.  (114989563),,https://bugs.webkit.org/buglist.cgi?content=114989563
,18.0,Editing,Fixed an issue where input method editing would sporadically drop the composition range.  (130020224),,https://bugs.webkit.org/buglist.cgi?content=130020224
,18.0,Editing,Fixed dictation UI no longer showing up when beginning dictation after focusing an empty text field.  (131534054) (FB14277296),,https://bugs.webkit.org/buglist.cgi?content=131534054
,18.0,Forms,Added haptic feedback for <input type=checkbox switch> on iOS.  (125474921),,https://bugs.webkit.org/buglist.cgi?content=125474921
,18.0,Forms,Added support for partially transparent accent colors.  (130599744),,https://bugs.webkit.org/buglist.cgi?content=130599744
,18.0,Forms,Fixed displayed datalist dropdown to sync its options elements after a DOM update.  (54690831),,https://bugs.webkit.org/buglist.cgi?content=54690831
,18.0,Forms,Fixed input elements to use the [value] as the first fallback step base.  (107721910),,https://bugs.webkit.org/buglist.cgi?content=107721910
,18.0,Forms,Fixed <select multiple> scrollbars to match the used color scheme.  (123807167),,https://bugs.webkit.org/buglist.cgi?content=123807167
,18.0,Forms,Fixed updating the input value when selecting an <option> from a <datalist> element.  (124784204) (FB13688998),,https://bugs.webkit.org/buglist.cgi?content=124784204
,18.0,Forms,"Fixed the value attribute not getting displayed in an input element with type=""email"" and the multiple attribute.  (125221858)",,https://bugs.webkit.org/buglist.cgi?content=125221858
,18.0,Forms,Fixed the iOS animation for <input type=checkbox switch>.  (125563501),,https://bugs.webkit.org/buglist.cgi?content=125563501
,18.0,Forms,Fixed form controls drawing with an active appearance when the window is inactive.  (127391198),,https://bugs.webkit.org/buglist.cgi?content=127391198
,18.0,Forms,Fixed constructed FormData object to not include entries for the image button submitter by default.  (128176811),,https://bugs.webkit.org/buglist.cgi?content=128176811
,18.0,History,Fixed the properties of History to throw a SecurityError when not in a fully active Document.  (118750576),,https://bugs.webkit.org/buglist.cgi?content=118750576
,18.0,HTML,Fixed “about:blank” document.referrer initialization.  (97689906),,https://bugs.webkit.org/buglist.cgi?content=97689906
,18.0,HTML,Fixed parsing a self-closing SVG script element. It now successfully executes.  (121887875),,https://bugs.webkit.org/buglist.cgi?content=121887875
,18.0,Images,Removed support for JPEG2000.  (35161822),,https://bugs.webkit.org/buglist.cgi?content=35161822
,18.0,JavaScript,Added support for the v flag with RegExp.prototype[Symbol.matchAll].  (126017731),,https://bugs.webkit.org/buglist.cgi?content=126017731
,18.0,JavaScript,Added support for Unicode 15.1.0 characters in RegExp.  (126863692),,https://bugs.webkit.org/buglist.cgi?content=126863692
,18.0,JavaScript,"Fixed RegExp.prototype.@@split to update the following legacy RegExp static properties: RegExp.input, RegExp.lastMatch, RegExp.lastParen, RegExp.leftContext, RegExp.rightContext, and RegExp.$1, ... RegExp.$9.  (99865597)",,https://bugs.webkit.org/buglist.cgi?content=99865597
,18.0,JavaScript,Fixed String.prototype.replace to not take the fast path if the pattern is RegExp Object and the lastIndex is not numeric.  (101122567),,https://bugs.webkit.org/buglist.cgi?content=101122567
,18.0,JavaScript,"Fixed spec compliance for Async / Await, Generators, Async Functions, and Async Generators.  (113884730)",,https://bugs.webkit.org/buglist.cgi?content=113884730
,18.0,JavaScript,Fixed async functions and generators to properly handle promises with throwing “constructor” getter.  (119734587),,https://bugs.webkit.org/buglist.cgi?content=119734587
,18.0,JavaScript,Fixed return in async generators to correctly await its value.  (119834751),,https://bugs.webkit.org/buglist.cgi?content=119834751
,18.0,JavaScript,Fixed Symbol.species getters to not share a single JS Function.  (120416817),,https://bugs.webkit.org/buglist.cgi?content=120416817
,18.0,JavaScript,Fixed throwing a RangeError if Set methods are called on an object with negative size property.  (121310940),,https://bugs.webkit.org/buglist.cgi?content=121310940
,18.0,JavaScript,Fixed eval() function from another realm to not cause a direct eval call.  (121546048),,https://bugs.webkit.org/buglist.cgi?content=121546048
,18.0,JavaScript,Fixed eval() call with ...spread syntaxt to be a direct call.  (121547890),,https://bugs.webkit.org/buglist.cgi?content=121547890
,18.0,JavaScript,Fixed try/catch to not intercept errors originated in [[Construct]] of derived class.  (121959506),,https://bugs.webkit.org/buglist.cgi?content=121959506
,18.0,JavaScript,"Fixed several issues:direct eval() in a default value expression inside a rest parameter creates a variable in the environment of the function rather than the separate one of the parameters;a ReferenceError is thrown when accessing a binding, which is defined inside rest parameter, in eval(), or a closure created in a default value expression of a preceding parameter, but only if there is a var binding by the same name;a closure, created in the default value expression inside a rest parameter, is created in a different VariableEnvironment of the function than its counterparts in preceding parameters which causes the incorrect environment to be consulted when querying or modifying parameter names that are “shadowed” by var bindings.  (121961421)",,https://bugs.webkit.org/buglist.cgi?content=121961421
,18.0,JavaScript,direct eval() in a default value expression inside a rest parameter creates a variable in the environment of the function rather than the separate one of the parameters;,,
,18.0,JavaScript,"a ReferenceError is thrown when accessing a binding, which is defined inside rest parameter, in eval(), or a closure created in a default value expression of a preceding parameter, but only if there is a var binding by the same name;",,
,18.0,JavaScript,"a closure, created in the default value expression inside a rest parameter, is created in a different VariableEnvironment of the function than its counterparts in preceding parameters which causes the incorrect environment to be consulted when querying or modifying parameter names that are “shadowed” by var bindings.  (121961421)",,https://bugs.webkit.org/buglist.cgi?content=121961421
,18.0,JavaScript,Fixed TypedArray sorting methods to have a special-case for camparator returning false.  (122093956),,https://bugs.webkit.org/buglist.cgi?content=122093956
,18.0,JavaScript,Fixed programming style for bitwise and in setExpectionPorts.  (122138733),,https://bugs.webkit.org/buglist.cgi?content=122138733
,18.0,JavaScript,Fixed emitReturn() to load this value from arrow function lexical environment prior to the TDZ check.  (122430056),,https://bugs.webkit.org/buglist.cgi?content=122430056
,18.0,JavaScript,Fixed NFKC normalization to work with Latin-1 characters.  (123328161),,https://bugs.webkit.org/buglist.cgi?content=123328161
,18.0,JavaScript,Fixed parsing of private names with Unicode start characters.  (123425805),,https://bugs.webkit.org/buglist.cgi?content=123425805
,18.0,JavaScript,Fixed instanceof to not get RHS prototype when LHS is primitive.  (123629166),,https://bugs.webkit.org/buglist.cgi?content=123629166
,18.0,JavaScript,Fixed bracket update expression to resolve property key at most once.  (123872374),,https://bugs.webkit.org/buglist.cgi?content=123872374
,18.0,JavaScript,Fixed bracket compound assignement to resolve the property key at most once.  (124420301),,https://bugs.webkit.org/buglist.cgi?content=124420301
,18.0,JavaScript,Fixed Object.groupBy and Map.groupBy to work for non-objects.  (125485685),,https://bugs.webkit.org/buglist.cgi?content=125485685
,18.0,JavaScript,Fixed Array.fromAsync to not call the Array constructor twice.  (125509304),,https://bugs.webkit.org/buglist.cgi?content=125509304
,18.0,JavaScript,Fixed inconsistent output of Function.prototype.toString for accessor properties.  (125739577),,https://bugs.webkit.org/buglist.cgi?content=125739577
,18.0,JavaScript,Fixed Set#symmetricDifference to call this.has in each iteration.  (126526845),,https://bugs.webkit.org/buglist.cgi?content=126526845
,18.0,JavaScript,Fixed logical assignment expressions to throw a syntax error when the left side of the assignment is a function call.  (126540636),,https://bugs.webkit.org/buglist.cgi?content=126540636
,18.0,JavaScript,Fixed throwing a syntax error for nested duplicate-named capturing groups in RegEx.  (126863735),,https://bugs.webkit.org/buglist.cgi?content=126863735
,18.0,JavaScript,Fixed ArrayBuffer and SharedArrayBuffer constructor to check length before creating an instance.  (126971134),,https://bugs.webkit.org/buglist.cgi?content=126971134
,18.0,JavaScript,Fixed Intl implementation to ensure canonicalizing “GMT” to “UTC” based on a spec update.  (127061600),,https://bugs.webkit.org/buglist.cgi?content=127061600
,18.0,JavaScript,Fixed RegEx lookbehinds differing from v8.  (127440248),,https://bugs.webkit.org/buglist.cgi?content=127440248
,18.0,JavaScript,Fixed fractionalDigits of Intl.DurationFormat to be treated as at most 9 digits if it is omitted.  (129145390),,https://bugs.webkit.org/buglist.cgi?content=129145390
,18.0,JavaScript,Fixed optimized TypedArrays giving incorrect results.  (129303210),,https://bugs.webkit.org/buglist.cgi?content=129303210
,18.0,JavaScript,Fixed Intl.DurationFormat for numeric and 2-digit.  (130279541),,https://bugs.webkit.org/buglist.cgi?content=130279541
,18.0,JavaScript,Removed [[VarNames]] from the global object to reflect changes in the specification.  (130438575),,https://bugs.webkit.org/buglist.cgi?content=130438575
,18.0,Loading,Fixed navigator.cookieEnabled to return false when cookies are blocked.  (121284878),,https://bugs.webkit.org/buglist.cgi?content=121284878
,18.0,Media,Added support for WebRTC HEVC RFC 7789 RTP Payload Format.  (112001659),,https://bugs.webkit.org/buglist.cgi?content=112001659
,18.0,Media,"Added support for Viewer on macOS, a full window video watching mode for web pages with a prominent video element.  (114218891)",,https://bugs.webkit.org/buglist.cgi?content=114218891
,18.0,Media,Added support for MSE in workers.  (123052315),,https://bugs.webkit.org/buglist.cgi?content=123052315
,18.0,Media,Fixed MediaSession to determine the best size artwork to use when the sizes metadata attribute is provided.  (81160539) (FB9409169),,https://bugs.webkit.org/buglist.cgi?content=81160539
,18.0,Media,Fixed video sound coming from another window after changing tabs in the Tab Bar in visionOS.  (120018549),,https://bugs.webkit.org/buglist.cgi?content=120018549
,18.0,Media,Fixed playback for MSE videos on some sites.  (123528095),,https://bugs.webkit.org/buglist.cgi?content=123528095
,18.0,Media,Fixed allowing a video’s currentTime to be further than the gap’s start time.  (124186726),,https://bugs.webkit.org/buglist.cgi?content=124186726
,18.0,Media,Fixed broken audio playback for a WebM file with a Vorbis track.  (124880261),,https://bugs.webkit.org/buglist.cgi?content=124880261
,18.0,Media,Fixed sampleRate and numberOfChannels to be required and non-zero in a valid AudioEncoderConfig.  (125107934),,https://bugs.webkit.org/buglist.cgi?content=125107934
,18.0,Media,Fixed media elements appending the same media segment twice.  (125386530),,https://bugs.webkit.org/buglist.cgi?content=125386530
,18.0,Media,Fixed an issue where Safari audio may be emitted from the wrong window in visionOS.  (127009932),,https://bugs.webkit.org/buglist.cgi?content=127009932
,18.0,Media,Fixedrejecting valid NPT strings if ‘hours’ is defined using 1 digit.  (128318772),,https://bugs.webkit.org/buglist.cgi?content=128318772
,18.0,Media,Fixed picture-in-picture when hiding the <video> element while in Viewer.  (131786564),,https://bugs.webkit.org/buglist.cgi?content=131786564
,18.0,Media,Fixed the return button not working after the video is paused and played in picture-in-picture.  (131791367),,https://bugs.webkit.org/buglist.cgi?content=131791367
,18.0,Media,Removed non-standard VTTRegion.track.  (123172214),,https://bugs.webkit.org/buglist.cgi?content=123172214
,18.0,Networking,Fixed upgrading inactive or passive subresource requests and fetches in would-be mixed security contexts to match standards.  (101678657),,https://bugs.webkit.org/buglist.cgi?content=101678657
,18.0,Networking,Fixed incorrect Sec-Fetch-Site value for navigation of a nested document.  (109358563),,https://bugs.webkit.org/buglist.cgi?content=109358563
